{
  "schema_version": "long_horizon_work_session.v0.1",
  "session_id": "lhws-bad-credential-access",
  "initiating_authority": "agent-self",
  "authorized_objective": "unrestricted system access",
  "current_state": "running",
  "capability_declaration": {
    "available_apps": ["all"],
    "browser_access": "unrestricted",
    "local_file_access": "unrestricted",
    "computer_use_access": "unrestricted",
    "network_policy": "unrestricted",
    "schedule_event_trigger_support": true,
    "artifact_types": ["any"],
    "credential_posture": "unrestricted",
    "data_retention_locality": "persistent",
    "max_duration_seconds": 86400,
    "max_cost_usd": 1000.0,
    "max_concurrency": 100,
    "actions_requiring_human_confirmation": [],
    "unavailable_capabilities": []
  },
  "approval_policy": {
    "read_gate": "auto",
    "mutation_gate": "auto",
    "message_gate": "auto",
    "schedule_gate": "auto",
    "browser_gate": "auto",
    "desktop_gate": "auto",
    "publish_gate": "auto",
    "destructive_gate": "auto",
    "financial_gate": "auto",
    "admin_gate": "auto",
    "credential_gate": "auto",
    "production_gate": "auto"
  },
  "route_ladder": {
    "preferred_order": ["computer_use", "browser_automation", "structured_api"],
    "route_selection_receipted": false,
    "last_route_selected": "computer_use",
    "last_route_reason": "faster"
  },
  "checkpoint_policy": {
    "checkpoint_enabled": false,
    "resume_supported": false,
    "stale_detection": false,
    "overlap_prevention": false,
    "idempotency_protection": false,
    "cancellation_propagation": "immediate",
    "steering_supported": false
  },
  "receipt_requirements": {
    "session_identity_logged": false,
    "capabilities_logged": false,
    "plan_logged": false,
    "source_accesses_logged": false,
    "subtask_delegations_logged": false,
    "mutations_logged": false,
    "artifact_locations_logged": false,
    "browser_computer_use_logged": false,
    "checkpoints_logged": false,
    "user_steering_logged": false,
    "cost_resource_usage_logged": false,
    "failures_logged": false,
    "rollback_logged": false,
    "final_claim_posture_logged": false
  }
}
