{
  "schema_version": "long_horizon_work_session.v0.1",
  "session_id": "lhws-001-valid",
  "initiating_authority": "human-operator",
  "authorized_objective": "Research and draft report on AI governance frameworks",
  "current_state": "running",
  "state_history": [
    {"state": "proposed", "timestamp": "2026-07-15T10:00:00Z", "reason": "session initiated"},
    {"state": "planned", "timestamp": "2026-07-15T10:05:00Z", "reason": "plan approved"},
    {"state": "running", "timestamp": "2026-07-15T10:06:00Z", "reason": "execution started"}
  ],
  "capability_declaration": {
    "available_apps": ["web_search", "document_editor"],
    "browser_access": "scoped",
    "local_file_access": "read_write_scoped",
    "computer_use_access": "denied",
    "network_policy": "allowlist",
    "schedule_event_trigger_support": true,
    "artifact_types": ["report", "summary"],
    "credential_posture": "prohibited",
    "data_retention_locality": "session-only",
    "max_duration_seconds": 14400,
    "max_cost_usd": 5.00,
    "max_concurrency": 3,
    "actions_requiring_human_confirmation": ["publish", "send_message"],
    "unavailable_capabilities": ["computer_use", "payment"]
  },
  "approval_policy": {
    "read_gate": "auto",
    "mutation_gate": "auto",
    "message_gate": "confirm",
    "schedule_gate": "confirm",
    "browser_gate": "auto",
    "desktop_gate": "deny",
    "publish_gate": "confirm",
    "destructive_gate": "deny",
    "financial_gate": "deny",
    "admin_gate": "deny",
    "credential_gate": "deny",
    "production_gate": "deny"
  },
  "route_ladder": {
    "preferred_order": ["structured_api", "native_file_op", "browser_automation", "computer_use", "human_action"],
    "route_selection_receipted": true,
    "last_route_selected": "structured_api",
    "last_route_reason": "web_search API available and scoped"
  },
  "checkpoint_policy": {
    "checkpoint_enabled": true,
    "checkpoint_interval_seconds": 300,
    "resume_supported": true,
    "stale_detection": true,
    "stale_timeout_seconds": 1800,
    "overlap_prevention": true,
    "idempotency_protection": true,
    "cancellation_propagation": "graceful",
    "steering_supported": true
  },
  "receipt_requirements": {
    "session_identity_logged": true,
    "capabilities_logged": true,
    "plan_logged": true,
    "source_accesses_logged": true,
    "subtask_delegations_logged": true,
    "mutations_logged": true,
    "artifact_locations_logged": true,
    "browser_computer_use_logged": true,
    "checkpoints_logged": true,
    "user_steering_logged": true,
    "cost_resource_usage_logged": true,
    "failures_logged": true,
    "rollback_logged": true,
    "final_claim_posture_logged": true
  }
}
